年,月,日,標題,內容,報社
2014,3,4,４資深遺珠304歲 梅姨算小妹 茱蒂丹契近失明 影迷憂心健康,本屆奧斯卡獎是新人綻放光彩的一年，眾多深耕多年的老牌演員入圍，全數槓龜，《八月心風暴》中64歲的梅莉史翠普（梅姨）、《內布拉斯加》裡77歲的布魯斯鄧、84歲的瓊史桂布、《遲來的守護者》79歲的茱蒂丹契，總共304歲，堪稱「陳年遺珠」，茱蒂更驚爆雙眼幾乎失明，再當遺珠的機會恐怕也不多了。茱蒂第７度入圍，在《遲來》裡笑中有淚的演出，主掌觀眾的每個悲喜。她至今只以1998年的《莎翁情史》拿過最佳女配角，至今與影后無緣。她日前表示已無法自己讀劇本，連看電影都很困難，雖繼續拍片，但讓影迷憂心她的健康。總在電影裡演惡人或配角的布魯斯鄧，影壇沉浮55年，在《內布拉斯加》中演的老父，歷盡滄桑的詮釋，讓人聯想到他現實中只求捲土重來的心境。瓊史桂布在該片中飾演布魯斯嘴利心軟的太太，對著墳墓撩裙的一幕戲搶盡風采。縱使今年新人表現亮眼，仍讓人惋惜老將未能戲劇化地出頭。梅姨在《八月心風暴》飾演她演過的最粗俗惡毒的角色，雖未得獎，但她已破紀錄入圍18次，年齡上與上述老將相比，只是「小妹」，再見奧斯卡是絕對可能的。,中國時報
2014,3,4,艾倫酸入圍者 要喬納希爾別曬鵰 典禮中叫披薩餵大明星 小布負責分盤子,第86屆奧斯卡再度找來脫口秀主持人艾倫狄珍妮主持，從一開場就妙語如珠，不僅猛酸、開入圍者玩笑，還打破「典禮不供餐」規則，在現場叫披薩外賣！飢腸轆轆的大明星，還真的當場「嗑」起來。拿同志身分開玩笑艾倫曾被讚譽是「地球上最幽默的女人」，大型典禮主持經驗豐富，曾４度主持艾美獎。2007年首度受邀主持第79屆奧斯卡，今年則是第２次主持。她的脫口秀《艾倫愛說笑》，訪遍大明星，當初一鳴驚人的「小胖」林育群，也曾接受該節目訪問。典禮一開場，她就開入圍者玩笑，講到「上過大學」的話題時，以《瞞天大佈局》入圍影后的艾美亞當斯就被她問得很尷尬，因艾美的學歷「沒那麼高」（僅高中畢業）；還有入圍小金人紀錄保持人梅莉史翠普（梅姨）也中槍，艾倫建議她別再入圍了，因治裝跟化妝費用要花「一大筆錢」。早已出櫃的她，也拿自己同志身分來開玩笑，直說以《華爾街之狼》入圍男配角的喬納希爾，在片中秀出了她「很久沒有見到的東西。」（因他在片中秀出了「大鵰」，其實是假陽具）。之後在典禮進行中，又走到他旁邊，說：「不，我並不想看那個東西。」要求大咖賞小費她在典禮期間問大家，「有人餓了嗎？我想叫披薩」，包括珍妮佛勞倫斯、哈里遜福特、大導演馬丁史柯西斯等人都舉手贊成。結果她真的叫了附近的披薩店外送，還把外送小弟帶上舞台，更虧他：「茱莉亞羅勃茲在這，你要跟她說話嗎？」大明星們就在現場分起披薩，在現場吃了起來，「小布」布萊德彼特還幫忙分盤子。之後她拿著帽子跟大家要小費，大家都意思意思給了20美元（約新台幣600元），凱文史貝西還對她說：「賞妳的！」她聽了當場把他給的錢，還有女配角得主露琵塔尼詠歐給的一條脣膏，都收進自己口袋。小布則被酸小氣：「你兩部片只給我20元？」讓小布沒好氣的多「丟」了兩張鈔票。,中國時報
2014,3,4,珊卓艾美雙嬌撞色 珍妮佛「跌跌」不休,第86屆奧斯卡頒獎典禮３日上午９點半在洛杉磯杜比劇院舉行，星光大道８點率先登場。紅毯星光依舊璀璨，眾女星打安全牌居多，尤以黑白色當道，深藍色成為一抹異軍突起的綺彩。珊卓布拉克、艾美亞當斯兩位準影后都以藍彩吸睛，造型師林國基盛讚珊卓：「從胸前延伸到腰際的皺摺很有戲。」部落客「個人意見」也誇她大器。紅毯也見證灰姑娘的崛起，拿下最佳女配角的黑人女星露琵塔尼詠歐，以Prada冰藍色飄逸長禮服展現精靈之姿，穿出小女孩夢想成真的單純浪漫，不僅躍上國際時尚網站Style.com首頁，也狠踩珍妮佛勞倫斯，她雖穿Dior大紅色搶眼華服，但驚喜度不及露琵塔。凱特略顯保守珍妮佛勞倫斯去年以《派特的幸福劇本》拿影后，上台領獎時摔跤，今年再以《瞞天大佈局》入圍最佳女配角，沒想到在紅毯上剛說完自己不會再犯錯，還試走了一下，轉身就跌坐在地上！典禮主持人艾倫狄珍妮虧她，「奧斯卡不是一個競賽，是個慶典」，再說：「開玩笑，這是一場『飢餓遊戲』！」當場牽拖演出《飢餓》的她。她也創下連兩年在奧斯卡「跌倒」的紀錄。凱特布蘭琪一如預期，守住紅毯資優生的口碑，ArmaniPrive刺繡晚禮服搭完美髮妝，時尚達人Annie大讚：「即便裸色低調，依舊吸睛！」個人意見稍嫌美中不足，認為她向來勇於嘗試，這次略顯保守。每年都是焦點的安潔莉娜裘莉，一身ElieSaab透視裝展現胸部重建手術後的自信，也引來兩極評價，林國基認為她掌握亮片、透視等時尚元素，珠繡細節更添華麗；個人意見評為漸層的抹布，「讓原本沒有下垂的地方也顯得下垂了。」Annie也批像婚宴婆婆裝，老氣。艾瑪穿著老氣NG版本中的艾瑪華森，她似乎太急著長大，穿了媽媽的銀灰色金蔥禮服出席，挨評嫩臉蛋與熟女裝超不搭；夏莉茲賽隆的黑色Dior禮服性感搶鏡，可惜透明肩帶成為突兀焦點；梅莉史翠普也引起討論，鬆垮垂墜還是從容優雅？見仁見智。以《八月心風暴》入圍女配角的茱莉亞羅勃茲，穿黑色禮服出席。媒體指出，她因上月同母異父的妹妹南茜服藥自殺身亡才穿黑色。這也是她在該事件後首度現身，外傳她為此暴瘦，心力交瘁，不過昨天看來心情已平復不少。男星以傑瑞德雷托搶眼，SaintLaurent白色西裝搭紅色領結，穿出時尚好運道，反觀李奧納多狄卡皮歐等人穿著無新意，彷彿制服秀。,中國時報
2014,3,4,自拍照史上含金量最高 艾倫照片轉貼破紀錄 三星置入達陣,本屆奧斯卡，誰最搶鏡？不是影帝，也非影后，而是主持人艾倫狄珍妮登高一呼的群星自拍照！這張金獎帝后、巨星齊搶鏡的照片，在推特分享轉貼數一舉超越歐巴馬就職照，也打破推特轉貼紀錄，至截稿為止，直逼260萬次，也讓人一窺三星GALAXYNote３手機的成功置入手法。艾倫狄珍妮在頒獎典禮過程中玩心大起，找梅莉史翠普（梅姨）玩自拍，還笑說：「我們要打破推特的轉發紀錄！」結果，周圍的影帝影后、入圍者、來賓一同加入拍照，包括梅姨、布萊德彼特、安潔莉娜裘莉、珍妮佛勞倫斯、布萊德利古柏、茱莉亞羅勃茲、傑瑞德雷托、凱文史貝西、以及露琵塔尼詠歐等人都擠進來合照，最後由布萊德利拿三星白色GALAXYNote３掌鏡。加上昨天頒發的獎項，照片中的演員，共擁有11座小金人，也讓這張照片成為史上含「金」量最高的自拍照。艾倫即時上傳該照到推特，不少巨星塞不下，像裘莉臉被遮一半、傑瑞德有半邊臉被切掉。她笑說：「若布萊德利的手再長點就好了，史上最棒照片！」其實，艾倫是死忠蘋果迷，她在APPStore甚至還有１款益智遊戲供免費下載。昨在奧斯卡頒獎典禮上用GALAXYNote３大玩自拍，讓部分蘋果粉絲很不是滋味。果粉JesusDiaz在自己的網頁上說，他發現艾倫在後台分享照片時，仍然是用自己的iPhone，不解三星為何要找個大果粉站台。三星自2009年至今已是第五度贊助奧斯卡，外傳累計金額高達2400萬美元，超過７億台幣。2102年也贊助過全美音樂大獎，當時主持人用來宣布得獎者不是傳統卡片，而是１支GALAXYNote２。,中國時報
2014,3,7,不當落難貴婦 布蘭琪變身尋寶英雄,新科奧斯卡影后凱特布蘭琪，演技備受推崇，在新片「大尋寶家」中，一掃「藍色茉莉」的落難貴婦，轉身詮釋法國女英雄，與她對戲的麥特戴蒙直呼她是「變色龍」，導演兼男主角的喬治柯隆尼嘴甜讚她是「梅莉史翠普第二」。凱特布蘭琪成為第一個拿下小金人的澳洲女星，相當風光，但出道時的陳年「糗」照也被網友翻出來。她20年前拍的餅乾廣告，日昨被上傳YouTube，模樣清澀稚氣。那是凱特布蘭琪24歲時，為澳洲巧克力餅乾拍的30秒廣告。描述她看到阿拉丁神燈，擦拭後就冒出精靈，精靈說她可以許願，她便祈求「能有吃不完的巧克力餅乾」，果然空盒馬上又裝滿餅乾。而新片「大尋寶家」，是麥特戴蒙二度與凱特布蘭琪合作，距離上次合作已10多年，身分地位早已不可同日而語，麥特提及她為了角色，練就標準法式英文的腔調，連法籍影帝尚杜賈丹也被震懾，面對麥特的稱讚，布蘭琪回敬：「麥特的演技精準無誤，他是我有幸能合作到的真正好演員。」「大尋寶家」描述一群中年人，想從世界大戰中，搶救險被摧毀的藝術品故事，凱特布蘭琪與麥特戴蒙片中有段曖昧小插曲，她解釋兩人是對藝術品有共同理念，最終結為好友。,聯合報
2014,3,4,安海瑟薇個性美,李奧納多狄卡皮歐穿亞曼尼西裝。水晶裝飾好閃安海瑟薇穿GUCCI黑色禮服。從奧斯卡紅毯看流行趨勢，可發現服裝以黑色、裸色系與粉嫩色系等三大風格為主，女星挑款式也能看出年齡，年輕女星多愛個性款，如安海瑟薇的GUCCI晚禮服，款式與她去年的粉色削肩裝略為雷同，但黑色系多了個性，胸前水晶裝飾相當閃耀。輕熟女以上愛柔美款、裸色系，潔西卡貝兒的香奈兒訂製服就是代表，這件香奈兒春夏訂製服是雪紡材質，上綴有銀色刺繡，高貴典雅。潘妮洛普克魯茲穿上彷彿希臘女神的皺褶禮服，少了以往的華麗看頭，卻多了清新感。而梅莉史翠普一身浪凡上白下黑禮服，讓她小露香肩，優雅又大器，是許多資深女星的典範。娜歐蜜華茲的白色禮服也綴有不少花飾，配上一頭金髮，低空過關。而年輕派的女星很有主見，安海瑟薇的GUCCI禮服堪稱代表，而以往造型受好評的艾瑪華森，這次不僅包頭看來沒梳好，而Vera Wang禮服想走成熟感卻看來老氣，可惜了青春氣息。今年紅毯孕婦也特別多，凱莉華盛頓有Jason Wu首度操刀的奧斯卡禮服，緞面材質優雅卻也少了設計，比不上奧莉薇亞懷爾德穿黑色禮服，保守安全過關。而今年男星穿著普遍都以西裝為主，李奧納多狄卡皮歐的合身亞曼尼西裝合身帥氣，只可惜沒拿影帝，凱文史貝西則穿BURBERRY西裝，多了一點英倫時髦感。帥氣男星代表柴克艾福隆則穿Calvin Klein西裝凸顯好身材。另外，今年紅毯多位女星都頂著類似的髮型現身，包括短髮、包頭與波浪髮型。其中俐落短髮受到青睞，包括珍妮佛勞倫斯、安海瑟薇、莎莉塞隆、露琵塔妮詠奧等，雖然都是短髮，卻各有巧妙。安海瑟薇的短髮微鬈俐落，也讓她的五官更立體。波浪鬈髮包括有凱特布蘭琪、珊卓布拉克、潔西卡貝兒等人。潔西卡貝兒的微鬈髮是她的招牌，特別梳向同一邊，可露出配戴的珠寶耳環與項鍊，凱莉華盛頓的微鬈髮很有浪漫風情。包頭也是許多女星首選，梅莉史翠普梳來最優雅迷人，潘妮洛普走公主頭髮型，各展風情。,聯合報
2014,3,4,凱特布蘭琪 舞台劇底子 淬鍊慾望街車,九年前以「神鬼玩家」奪得奧斯卡最佳女配角的凱特布蘭琪，今年靠著伍迪艾倫為她量身打造的「藍色茉莉」更上層樓，已獲大大小小超過廿座影后，昨天如願拿下奧斯卡影后。致詞時她十分得體地向對手致敬，將自己成就歸功於雪梨的劇團，盛讚劇場工作令她變成一位更出色的女演員，接著高明地喊話：「感謝聰明且勇敢發行這部電影的片商，及進場欣賞的觀眾。業界某些人認為女性電影市場有侷限，其實觀眾想看這種電影，它們有賺頭，世界無限寬廣。」來自澳洲的凱特布蘭琪，堪稱梅莉史翠普接班人，同樣走知性氣質路線，也都從舞台劇磨出演技，就算電影片約不斷，仍會撥出時間重回舞台。看過「藍色茉莉」的觀眾都可感受其深受「慾望街車」影響，凱特真的在舞台上演過「慾」劇，導演還是柏格曼御用影后麗芙鄔嫚，由於反應突出，啟發伍迪艾倫找她拍攝二十一世紀版「慾望街車」─「藍色茉莉」的靈感。她在片中角色一樣是個落魄的昔日貴婦，一樣虛矯做作地維持破碎自尊，當殘酷現實不斷打擊，終於走到崩潰邊緣。角逐演技獎，外放的角色較佔便宜，「藍色茉莉」凱特布蘭琪神經質地搶眼，無怪乎其他入圍者各個強敵，加上「衝奧」最後關頭爆出導演伍迪艾倫捲入性侵養女醜聞，依舊沒讓她的小金人跑掉。人生際遇難料，她入行之初曾在葛倫克蘿絲掛帥的「火線浮生錄」擔任配角，今年她和葛倫克蘿絲再度先後走上奧斯卡舞台，她已兩座小金人在手，葛倫卻六度入圍始終無緣。凱特今年還打敗知性演技派掌門人梅莉史翠普，以及英國前輩茱蒂丹契。,聯合報
2014,3,4,巨星玩自拍 三星置入行銷,為了置入三星手機，艾倫狄珍妮絲號召出席奧斯卡頒獎典禮的巨星們自拍，締造照片在推特上轉發的新紀錄。本屆奧斯卡頒獎典禮的最大亮點在台下，主持人艾倫狄珍妮絲揪十二位巨星搞史上最強自拍照，刷新社群網站推特（Twitter）的轉推紀錄，讓贊助商三星的一款手機置入，創造話題也讓人見識到好萊塢如何成功與商業結合。奧斯卡的閃閃星光，商機無限，背後也經過精密計算。據外電報導，三星以七點五億台幣連續五年贊助奧斯卡，今年不僅在頒獎典禮發布新型手機廣告，還巧妙讓主持人艾倫狄珍妮絲拿著手機邊拍照、邊打電話，最後創造出「巨星們的自拍照」；三星事後也坦承是置入，但表示如何秀出手機全由奧斯卡決定。在巧妙的安排下，艾倫在節目中段走到梅莉史翠普座位旁說：「妳已有破紀錄的十八次入圍，我們再來破一個紀錄─史上最多人轉發的推特照片。」梅莉邀茱莉亞羅勃茲，接著查寧塔圖、傑瑞李托、珍妮佛勞倫斯、凱文史貝西、布萊德利庫柏都衝上來，連布裘夫妻檔都甘願擠在後面當背景，眾星眉開眼笑，留下一張自拍照。艾倫發照上推特：「如果布萊德利的手臂再長一點就好了。」上傳後瞬間爆量，一小時轉推衝破兩百萬次，導致推特伺服器當機。,聯合報
2014,3,3,奧斯卡今登場 考驗艾倫吸睛力,奧斯卡頒獎典禮現場，杜比劇院門外的星光大道，工作人員忙著做好防雨措施。艾倫今年主持奧斯卡頒獎，壓力大。奧斯卡頒獎典禮台北時間今天上午9點半在美國洛杉磯舉行，杜比劇院門口外的星光大道紅地毯已做好防雨措施，觀眾好奇典禮會端出什麼精采節目滿足大家，媒體則忙著逼有投票權的會員匿名亮票，想搶先嗅出得獎態勢。Star World、Star Movies、Star Movies HD及台視，今天上午8點起直播星光大道及頒獎，今晚9點Star Movies、Star Movies HD及台視，將會重播頒獎的中文字幕版。 去年奧斯卡頒獎典禮，主持人賽思麥克法蘭雖然笑話有時過火，卻向來討年輕觀眾喜愛，收視比前年好。今年主持人艾倫曾在7年前掌舵，表現沉穩，收視人數逼近4000萬，這回是否再次安全過關？各方都在等著瞧。受青少年喜愛的柴克艾福隆、查寧塔圖、安娜坎卓克、珍妮佛勞倫斯等都會出席，熱賣卡通「冰雪奇緣」配音女主角伊迪娜曼佐現身演唱入圍歌曲「Let It Go」，製作單位還安排向「綠野仙蹤」75周年致敬、貝蒂蜜勒表演等主打年長影迷的段落，希望收視群能一網打盡。目前搶先亮出會員票，「自由之心」頗受歡迎，「遲來的守護者」、「藥命俱樂部」也受青睞，影帝方面馬修麥康納被「瞞天大佈局」克里斯汀貝爾追得最緊，影后雖大都投凱特布蘭琪，珊卓布拉克等人也有支持票，只有梅莉史翠普似乎今年較冷門。而以「愛在希臘午夜時」獲奧斯卡最佳原著劇本提名的茱莉蝶兒，雖是入圍者，但卻大聲批評奧斯卡主辦單位。她說，影藝學院成員有九成70歲以上白種男性，因為長期沒任何作為，所以要錢，只要給他們兩三樣禮物就行了。直來直往的茱莉蝶兒表示，1990年代的奧斯卡獎確實有真正的獨立製片，但又逐漸被主流電影取代，「老實說，九成好萊塢電影都是個屁！」,聯合報
2013,2,28,好萊塢演員讚李安如佛祖,阿努班克爾在「派特的幸福劇本」飾演布萊德利庫柏的心理醫師。李安在奧斯卡頒獎典禮感謝「電影之神」，成為當晚唯一謝神的得獎者。李安以充滿宗教意涵的「少年PI的奇幻旅程」贏得奧斯卡最佳導演獎，第一個感謝的就是「電影之神」，成為當晚唯一謝神的得獎者。而在印度裔好萊塢演員阿努班克爾的心中，李安就跟佛祖一樣。克爾曾演色．戒鑽石商阿努班克爾是印度知名演員，他就是「色．戒」中賣鴿子蛋鑽戒給梁朝偉與湯唯的商人，他也演過伍迪艾倫的「命中注定，遇見愛」，又在今年入圍奧斯卡的「派特的幸福劇本」飾演布萊德利庫柏的心理醫師。克爾沒演出「少年PI的奇幻旅程」，但他還是在奧斯卡頒獎典禮見到李安，問他：「你感覺如何？」李安回答：「沒感覺。」他再問李安：「星期一以後你要做什麼？」李安回答：「我還不知道。」 蘇瑞吉讚李安撫平人心克爾稱讚李安是個非常棒的人，才氣縱橫又非常平靜，像佛祖一樣。飾演少年PI的蘇瑞吉沙瑪也說過李安是他認識最平靜的人，只要他出現，原本焦慮不安的工作人員都相信一切問題會迎刃而解。雖然李安在台上感謝電影之神，又把觀音山的形象融入「少年PI」的漂浮島，但他自己其實是「不可知論者」，不確定也不否認神的存在。以往常有得獎者感謝上帝，今年卻沒有半個。近幾年在台上感謝上帝的則有梅莉史翠普、奧塔薇亞史班森、娜塔莉波曼、瑪莉莎李歐等女星，以及導演湯姆霍柏。,自由時報
2013,2,26,戴路易斯 3度稱帝,戴路易斯從梅莉史翠普丹尼爾戴路易斯以「林肯」贏得個人第3座奧斯卡影帝，不但刷新了影史紀錄，也為自己的演藝生涯再創高峰！笑稱原要演柴契爾夫人戴路易斯是好萊塢公認的戲精，他在影壇的地位猶如男性版的「梅姨」梅莉史翠普，對此他也幽默自嘲。梅姨去年以「鐵娘子：堅固柔情」封后，她昨天把最佳男主角頒給戴路易斯，他神來一筆，笑說自己本來想去演柴契爾夫人，梅姨才是演「林肯」的第一人選，令全場哄堂大笑。 戲精怪咖 感謝老婆容忍戴路易斯在台上特別感謝老婆蕾貝卡米勒，他說：「我們16年前結婚，從那時候開始，我的老婆就跟一個很怪咖住在一起…或許不只一個，而是一群怪咖！」言下之意，戴路易斯自認個性古怪又善變，「儘管如此，我的老婆一直是個完美的伴侶。」影帝獲肯定 歸功金三角戴路易斯在「我的左腳」裡飾演腦性麻痺作家，演技令人大開眼界；他在「黑金企業」詮釋一夜致富的貪婪與慾望，為自己贏得第2座奧斯卡；如今戴路易斯把美國第16任總統林肯扮演得維妙維肖，不但口音、外型到位，他還將解放黑奴的熱情與真誠完美呈現。影帝看似非他莫屬，他卻謙虛地表示：「我要感謝金三角：編劇東尼庫許納，導演史蒂芬史匹柏，還有林肯。」,自由時報
2013,2,26,戴路易斯3稱帝破紀錄 小珍妮佛仆街瘋后,小班《亞果》最佳影片第3度稱帝的戴路易斯詮釋林肯總統唯妙唯肖，55歲的他從梅莉史翠普手中接過小金人，全場起立鼓掌，他開玩笑說：「導演史蒂芬史匹柏原本屬意梅莉飾演林肯，她不演才換我演。」小珍妮佛在《派》片飾演性成癮的寡婦，聽到自己得獎大表意外，上台時踩到裙襬仆街，全場觀眾起立鼓掌，她尷尬說：「你們起立是因為同情我摔倒吧。太糗了，謝謝你們，太瘋狂了。」22歲的她是影史第2年輕的奧斯卡影后，最年輕的是1987年憑《悲憐上帝的女兒》以21歲封后的瑪莉麥特琳。小珍妮佛到後台受訪時，攝影記者提醒她「注意腳步」，她竟皺眉比中指。媒體問她是否擔心少年得志大不幸？她隨口說：「誰知道啊？走著瞧吧！」美國第一夫人蜜雪兒歐巴馬昨在白宮和人在頒獎會場的資深影星傑克尼柯遜視訊連線，共同頒發最佳影片給《亞果出任務》。小班和製片喬治克魯尼領獎，他說：「謝謝參與本片的人，謝謝我們在伊朗的朋友。謝謝我的妻子（珍妮佛嘉納）。」並將小金人獻給3名子女。該片共獲最佳影片、最佳改編劇本和最佳剪輯等3獎。影帝 丹尼爾戴路易斯 Daniel Day-Lewis國籍：英國年齡：55歲得獎作：《林肯》（Lincoln）奧斯卡得獎紀錄：第3次影后 珍妮佛勞倫斯 Jennifer Lawrence國籍：美國年齡：22歲得獎作：《派特的幸福劇本》（Silver Linings Playbook）奧斯卡得獎紀錄：初次,蘋果日報
2013,3,2,「我沒興趣」 轉身背對 娜姊好膽耍大牌不甩李安 梅姨讚大導謙虛 嫉妒女兒拍《胡士托》,李安導演剛以《少年PI的奇幻漂流》在奧斯卡再度大放異彩，「與李安合作」，已經成全球電影人的夢想，但西洋天后瑪丹娜（娜姊），竟大牌到竟給李安臉色看！英國《每日郵報》報導，在一場奧斯卡前幾天的派對上，李安試圖向瑪丹娜打招呼自我介紹，她卻對他毫不理會，還無禮地說「我沒興趣」，向來以有禮貌出名的李安，再度試圖對她說話，她竟乾脆轉身背向他。稱曾邀李安撇無禮目擊者表示，當日是好萊塢經紀公司CAA所舉辦的派對，巨星雲集，李奧納多狄卡普利歐、安海瑟薇、布萊德利古柏、珍妮佛安妮斯頓都是嘉賓。但娜姊那天非常誇張，整個人好像吃錯藥一樣烏雲罩頂，對每個人都很兇。一名與她工作的助理，則堅稱她當天心情很好，只是向來在這種場合，不會刻意故作開心地跟人打招呼，所以很多人可能會以為她很難搞、耍大牌。她的助理堅稱她絕沒有對李安無禮，事實上還邀請李安去她自己舉辦的奧斯卡派對。瑪丹娜或許不買李安的帳，但「演技女神」梅莉史翠普（梅姨）對李安卻尊敬得很。史翠普去年奧斯卡封后作品《鐵娘子：堅固柔情》終於將在大陸上映，為此她接受大陸媒體越洋採訪。《鳳凰網》報導，她對剛在奧斯卡拿下最佳導演的李安，印象非常好：「我很喜歡李安！也很願意跟李安合作。事實上，我女兒已經在《胡士托風波》中跟李安合作過了，我還挺嫉妒她的。」梅姨誇《PI》神奇史翠普並說：「我覺得李安是非常有才華的人，多才多藝，最重要的是風格多變，每一部都不一樣，讓人覺得既有變化又有驚喜。這次的《少年PI》也讓我非常喜歡，簡直是他作品中最神奇的一部。李安是很謙卑的一個人。像昆丁泰倫提諾就屬於很高調的人，但李安比較低調，非常不願意彰顯，特別謙卑。」。,中國時報
