年,月,日,標題,內容,報社
2013,2,26,演啥像啥寫傳奇 戴路易斯３度稱帝 笑傲奧斯卡 22歲勞倫斯封后摔個狗吃屎 賺足曝光率,英國男星丹尼爾戴路易斯，在《林肯》中飾演美國總統林肯，珍妮佛勞倫斯在《派特的幸福劇本》中飾演年輕寡婦，雙雙奪下第85屆奧斯卡影帝后。丹尼爾由去年《鐵娘子：堅固柔情》影后梅莉史翠普手中獲獎，一個是英國人演美國總統，一個則是美國人演英國首相佘契爾夫人，都是演什麼像什麼的演技之神。向來謙遜出名的丹尼爾，雖成為第一位３屆奧斯卡影帝，卻說：「我真的不知道這些事情怎麼發生的。我只知道我此生所蒙受的好運，已遠超過我所應得。」影帝謝妻子16年包容55歲的他素以長期進入角色出名，演出時不論戲裡戲外都以角色身分生活，因此特別感謝與他結褵16年的妻子蕾貝卡，「必須忍受與一個奇怪的男人共同生活。」他說演出林肯後必須休息幾年，暫時無法思考還想挑戰什麼高難度人物。他常為角色挑戰各種惟妙惟肖的高難度口音，被媒體問是否下戲後仍走不出角色？他馬上開玩笑地以林肯的口音答：「如果我不小心又陷了進去，你們隨時糾正我。但現在我絕對已經從角色中解脫出來了。」領獎時他還半開玩笑說，３年前曾考慮演佘契爾，梅莉史翠普其實是《林肯》導演史蒂芬史匹柏心中飾演林肯的最佳人選：「我倒很想看看那個版本。」許多觀眾最愛等著看女星穿禮服時跌倒出糗，今年願望成真。珍妮佛勞倫斯年僅22歲就勇奪影后，上台時因禮服過長，當場跌在台階上，搶盡得獎風光，又成為意外焦點。她為出席典禮整天沒吃東西，雖已因禮服過長裁掉６吋，卻仍在上台時跌倒，坐在前排的休傑克曼立刻衝上前扶她起身。影后被質疑故意跌倒她是迪奧代言人，日前也曾因禮服設計在上台被懷疑走光，如今又出狀況，迪奧被懷疑設計有問題，卻也賺足曝光率。她說，跌倒時很想罵髒話，在後台還被媒體質疑是否故意跌倒搶鏡，她自嘲：「絕對是的。你還問我發生什麼事？你看看我的禮服，我在上台時踩到裙襬，而且他們樓梯又打了蠟。」她已連獲金球獎、銀幕演員公會獎影后，畢竟太年輕不懂拿捏，常因開錯玩笑而頻惹爭議，曾說「我打敗梅莉史翠普」而挨轟傲慢。但她在奧斯卡上表現進步，上台後看到全場起立，馬上自嘲：「你們是因為看到我跌倒很丟臉才起立的，但還是謝謝你們。」她也感謝今年所有優秀女性影人，並祝當天生日的艾曼紐麗娃生日快樂，一掃近日被懷疑大頭症的負面形象。但她到了後台故態復萌，拍照時一路搞笑，還以喝點酒為由，開玩笑地對媒體舉中指。,中國時報
2013,2,27,奧斯卡PARTY 梅莉史翠普金色浪凡絕配,許多沒在紅毯出現的女星穿著也成焦點，頒發影帝的梅莉史翠普，身穿浪凡設計總監Alber Elbaz為她量身打造的金色亮片禮服，被時尚評論家譽為「最大器的穿著」。梅莉史翠普最近熱愛法國精品浪凡，去年她以「鐵娘子」奪下影后時，身上的金色戰袍同樣是浪凡，今年她改當頒獎嘉賓，同樣的低胸金色亮片禮服，襯托出她一線女星的地位，浪凡配梅姨，堪稱是奧斯卡的絕配。而美國第一夫人蜜雪兒歐巴馬連線頒獎時，身上的銀色亮片禮服同樣受矚目，這套禮服出自印度裔設計師Naeem Khan之手，這也是蜜雪兒的愛牌。有趣的是，這套禮服露肩、低胸的設計，在伊朗國家通訊社播出時，被修改為高領、遮住雙肩的設計。而奧斯卡會後派對同樣迷人，甫獲影后的珍妮佛勞倫斯，換下讓她上台領獎時跌倒的Dior高級訂製服，換穿一套銀色低胸禮服，露出好身材，彷彿藉此呼應奧斯卡主持人調侃「沒見過珍妮佛的胸部」。最佳女配角安海瑟薇也同場現身，但她遮住好身材，選穿Saint Laurent淡藍色晚裝，胸前有交叉設計，整體看來依舊優雅大方。而華人女星范冰冰、李冰冰紅毯相見歡，李冰冰身為GUCCI亞太區代言人，當然穿上GUCCI春夏新裝，只是大波浪袖子的設計，被毒舌評論家說為：「會走路的花枝」。知性女星娜塔莉波曼穿Dior白色平胸的高腰晚禮服跑趴，白色看來優雅，她還配戴華人珠寶設計師Anna Hu的珠寶，頗有畫龍點睛的效果。,聯合報
2013,2,27,梅姨得天獨厚 娜歐蜜黛妃有影,奧斯卡獎塵埃落定，珍妮佛勞倫斯脫穎而出，奠定她在新世代女星的領先地位。而美國媒體也開始鎖定有機會參加明年角逐的新片，包括湯姆漢克斯、梅莉史翠普、妮可基嫚等新作都被注意，娜歐蜜華茲扮演已故黛妃的電影被視為她再度問鼎影后的力作。新生代女星艾瑪史東和克莉絲汀史都華雖很有名，但還沒有夯到演甚麼片，觀眾都肯買帳的程度。珍妮佛勞倫斯除「飢餓遊戲」要拍續集，驚悚片「地下弒」也拿下全美周末票房冠軍。奧斯卡封后，奠定她在新生代女星中的「一姊」地位。但潔西卡雀絲坦過去18個月主演的6部電影，角色間無共通性，但演甚麼像甚麼的精準度，被視演技派中新一代的「千面女郎」。而有美國媒體列出奧斯卡影片的提名、得獎公式之一是「梅莉史翠普主演」，影藝學院愛她愛到狂，她的新片「August: Osage County」改編自名舞台劇，製片人正是「亞果出任務」的喬治柯隆尼、葛蘭海斯洛與奧斯卡造勢天王哈維溫斯坦，其他主角包括茱莉亞羅勃茲、伊旺麥奎格等，想不被提名都很難。改編真人真事的還有兩位已故王妃－英國的黛安娜、摩納哥葛麗絲凱莉影片，分別由娜歐蜜華茲與妮可基嫚主演，兩人的演出都被看好提名影后。,聯合報
2013,2,26,3屆影帝 丹尼爾想演鐵娘子,英國出生的戲精丹尼爾戴路易斯，打敗所有美國男星，成為史上第一位三屆奧斯卡影帝，證明他的實力深受同業認同；他演戲時認真嚴肅，上台領獎時才展現他的幽默，昨天在台上笑稱自己曾經想爭取演「鐵娘子」，而梅莉史翠普本來才是「林肯」第一人選，被記者評為典禮上最佳笑梗。他在台上形容自己是個「戲瘋子」。演出「林肯」時，不只導演史蒂芬史匹柏在片廠都直呼他「總統先生」，片場通告表列出飾演林肯的演員名叫林肯，而非丹尼爾戴路易斯；他專心熟讀原著，靠簡訊與演他妻子的莎莉菲爾德及兩位片中的兒子喬瑟夫高登李維、格列佛麥葛拉斯培養感情，還曾用一八六○年代，類似林肯的書寫筆跡寫便條給喬瑟夫。丹尼爾戴路易斯受過嚴格的科班訓練，首度擔綱男主角的「布拉格的春天」口碑頗佳，丹尼爾雖是影評寵兒，卻非主流巨星。他在「我的左腳」成功詮釋腦性麻痺畫家入圍奧斯卡，影帝最人氣的人選卻是跟他一樣坐在輪椅上演的「七月四日誕生」湯姆克魯斯；開獎當晚，「外國人」丹尼爾打敗好萊塢美國自家天王小生，成為最熱門話題。拍「我的左腳」時，他為了感受坐在輪椅上的行動不便，下戲時也堅持坐輪椅出入，工作人員常得把他扛起來免得擋住鏡頭，不時氣得罵髒話。丹尼爾為求入戲，甚至不顧健康。拍「紐約黑幫」一度患重感冒，就是不肯聽從醫生建議穿一件較厚的外套，因為片中年代還沒有厚外套這種東西，醫生只好開強效抗生素給他。丹尼爾給人嚴肅、不易親近的感覺，其實私下感情頗豐，曾和同樣容易入戲的法國影后伊莎貝艾珍妮同居並生下一子。分手後也曾傳茱莉亞羅勃茲拿著「莎翁情史」劇本力邀他合演，擦出短暫的愛火。但在他和名劇作家亞瑟米勒的女兒蕾貝卡結婚後，緋聞便終止，他昨天也在台上感謝蕾貝卡一直扮演好賢內助的支持角色。,聯合報
2013,2,26,峰迴路轉 happy ending,今年奧斯卡最大「驚喜」莫過於李安以「少年PI的奇幻漂流」勇奪最佳導演。所謂「喜」是樂於接受這個結果；「驚」的是揭曉前，大部分的分析、賭盤，看好的都是「林肯」的史蒂芬史匹柏，我僅敢說李安「還有一拚」，意即有點希望但不能篤定，完全不像其他3個技術獎（攝影、配樂、視效）手到擒來。就結果看，班艾佛列克在導演提名意外出局，非但沒帶給史匹柏好處，成全的竟是李安！當初入圍，最跌破大家眼鏡的就是這項，得獎時再來次出其不意，負負得正，也算happy ending。奧斯卡不是真理（就像坎城推崇「愛‧慕」），但對李安導演之路絕對是里程碑。奧斯卡肯定了他跨越語言、文化、類型與制度隔閡的能耐，以及把文字轉化為影像的功力，也進一步確立他在美國影壇的正宗位置。李安致詞時不忘感謝家鄉，相信當時一塊在台中工作的劇組人員、甚至單純支持他的觀眾都與有榮焉，但請勿把李安的成功和台灣電影直接畫上等號而沾沾自喜，唯有承認當中的差異，才有辦法對症下藥，否則又只是熱熱鬧鬧一番後打回原形。今年奧斯卡稱得上意外的，大概只有「007：空降危機」和「00:30凌晨密令」共享最佳音效剪輯。奧斯卡投票人員眾多又採通訊，要勢均力敵到並列得獎，機率微乎其微。丹尼爾戴路易斯以「林肯」創下榮獲第3座奧斯卡影帝新紀錄，毫無僥倖。他在台上笑稱「林肯」本屬於梅莉史翠普，他則想角逐「鐵娘子」，展示難得一見的幽默。珍妮佛勞倫斯沒在金球獎後各種不利她的傳言下敗陣，打贏這場公關戰，證明小妮子不簡單，也教提名時創下大滿貫的「派特的幸福劇本」不至於抱蛋，但可惜了「愛‧慕」爐火純青且機會難再的艾曼紐麗娃。一家歡樂幾家愁，本就是競賽寫照。但看一票明星無論入圍與否願意出席、甚至練歌練舞，即使看上的是頒獎的收視宣傳力，卻也展示了自身的認同與專業。原本有點詭譎的入圍名單，在最後卻讓我們喜出望外，這屆奧斯卡也算峰迴路轉吧！,聯合報
2012,2,29,鐵娘子日吸400萬 分居風暴票房加倍-影帝尚杜賈丹尬舞老師 領獎飆髒話惹火老媽,奧斯卡影帝尚杜賈丹奧斯卡效應發燒！「梅姨」梅莉史翠普封后，她主演的「鐵娘子：堅固柔情」票房連帶看漲，奧斯卡揭曉當天，全台票房就爆增400萬元，62歲梅姨依然很有票房魅力。最佳外語片「分居風暴」也表現不俗，雖然全台只有2廳放映，頒獎當天票房也倍增，全台票房逼近200萬元。分居風暴換大廳 大藝術家日進70萬梅姨打敗熱門人選薇歐拉戴維斯，驚險封后，締造本屆奧斯卡最大驚喜，也帶動了「鐵娘子」的票房，頒獎典禮當天就有400萬元進帳，全台票房累計1200萬元，聲勢看漲。「分居風暴」維持2家戲院放映，為了應付觀影需求，國賓長春影城昨天中廳換成大廳，真善美戲院的觀影人口也爆增1倍，讓「分居風暴」的票房在奧斯卡頒獎當天突增近30萬元。此外，最佳影片「大藝術家」目前全台票房累計約170萬元，頒獎當天的單日全台票房賺進了70萬元。梅姨真實吃香 杜賈丹出口成髒道歉梅姨於奧斯卡2度封后，連她自己都很驚訝；她自認美國媒體可能對她有誤解，認為她拿獎拿到手軟，但事實並非如此。她說：「媒體對我的倦意，我可以理解。」媒體熱烈討論為何她會打敗熱門的薇歐拉，主因可能是梅姨所飾演的柴契爾夫人是真實人物，比薇歐拉在「姊妹」所飾演的虛構人物吃香，更迎合奧斯卡評審的口味。尚杜賈丹榮登奧斯卡影帝，前天上台領獎時High過頭，一口氣講了一連串的法語，他說：「這實在是太驚奇了，太奇妙了，真的無法置信，謝謝你們！」其中也包括了相當於英文F開頭的法文髒字。對於兒子飆髒話，杜賈丹的母親表示不滿，杜賈丹隨即認錯，面對媒體說：「是呀，我很抱歉！」但無辜地說：「這真的沒什麼，這是法國人的常用語啦！」頒獎典禮隔天，影帝接受美國ABC電視台訪問時，心血來潮，當場與「大藝術家」的舞蹈老師法比恩盧茲尬舞，兩人秀了一段精彩的踢踏舞，超級興奮，讓兩位主持人凱莉里琶與尼爾派翠克哈里斯笑得合不攏嘴。,自由時報
2012,2,28,梅姨驚呼Oh my god 鐵娘子驚險逆轉勝,梅莉史翠普打敗原本呼聲最高的薇歐拉戴維斯，奧斯卡2度封后。！」頓時台下來賓全部起立鼓掌，畢竟這是梅姨繼1983年的「蘇菲亞的選擇」後第2次封后，這些年來她在奧斯卡頒獎典禮台下坐了14次的冷板凳，熬得也夠久了，台下影人無不給梅姨報以最熱烈的掌聲！梅姨自嘲：「可能會有一半的美國人對我拿獎有意見，會說：『怎麼又是她？』不過，是我又怎樣，管他的！」她感性地說：「首先我要先謝謝我的老公，因為我不想在發表感言的尾聲，匆促地感謝我的丈夫。唐，我生命中最珍重的就是你。」梅姨接著感謝跟她合作30年的化妝師傑羅伊荷倫，兩人從「蘇菲亞的選擇」就開始合作到現在，默契十足。梅姨最後表示：「謝謝各位新舊朋友，在這裡的或不在人世的，感謝你們的友誼和愛。」,自由時報
2012,2,28,奧斯卡３帝１后 演活政治人物,綜觀歷屆奧斯卡的最佳男女主角，有很多得主都是靠演繹政治人物獲得矚目，征服電影獎評審。除了本屆影后「梅姨」梅莉史翠普，另外海倫米蘭、柯林佛斯都是因為扮演英國皇室或政治人物而嶄露頭角，也因此順利登上奧斯卡帝后寶座。海倫米蘭 英國女王最佳代言人梅姨在「鐵娘子：堅固柔情」演活了英國前首相柴契爾夫人。柴契爾夫人從70年代到90年初活躍於英國政壇，讓台灣許多4、5、6年級生記憶猶新，而且柴契爾夫人本尊仍健在，所以要演出她的傳記電影，不免會被觀眾放大比較。不過梅姨的精湛演技通過了影迷這一關，雖然有影評認為此片像是梅姨的個人演技秀，她的表演比電影本身還強，外傳柴契爾夫人拒看此片，但美國影藝學院會員似乎認為以梅姨目前在影壇的地位，她絕對應得第2座奧斯卡影后。海倫米蘭也將英國女王伊莉莎白2世詮釋得相當出色。她跟本尊曾見過面，自己也被受封為英國女爵，在英國人民心目中，她就是英國女王的最佳代言人。柯林佛斯 惠塔克 班金斯利稱帝柯林佛斯去年以英國國王喬治6世的角色稱帝，佛瑞斯惠塔克、班金斯利也分別以歷史上著名的政治領袖阿敏、甘地摘下奧斯卡影帝，這些人物雖已走進歷史，但這3位演員以卓越的演技將他們注入新的生命力，接連獲得奧斯卡青睞，可謂實至名歸。,自由時報
2012,2,28,最佳影片幕後推手-大藝術家鍍金 溫斯坦巧妙布局,靠著美國發行商溫斯坦公司的慧眼與精密布局，「大藝術家」囊括各大影展獎項。記者鄒念祖／特稿製作人湯瑪士朗曼的全球票房，而5座奧斯卡獎又將替這部片的票房繼續加溫。有前例 王者之聲成功登頂去年哈維溫斯坦也是靠著他的公關運作，讓他買進的英國片「王者之聲」打敗原本呼聲頗高的「社群網戰」，在奧斯卡贏得影片、導演、影帝等4項大獎。「王者之聲」的成本也是1500萬美金，光是美國票房就有1.3億美金，獎項票房雙贏。捨大影展 不讓觀眾被誤導溫斯坦在2011年1月的日舞影展看了「大藝術家」後，便慧眼買下美國版權，然後讓它在5月的坎城影展開幕前2天，非常神奇的從觀摩片轉為競賽片，放映後反應熱烈，台灣還有2家發行商在搶版權，男主角尚杜賈丹也贏得坎城影帝。「大藝術家」在祖國坎城影展打完了漂亮的一仗後，北美首映選擇了知名度較低，位於科羅拉多的泰路萊德影展，而非北美最大的多倫多影展。因為溫斯坦希望觀眾與影評同時看片，讓觀眾第一時間感受它的魅力，才不會被影評誤導為一部沉悶的黑白片。得獎加持 票房三級跳「大藝術家」先於11月底在紐約與洛杉磯的幾間戲院上映，隨著各大影評人獎與金球獎頒獎，逐步增加上映規模。1月24日奧斯卡入圍揭曉後，「大藝術家」的票房就開始雙倍攀升。今年溫斯坦公司的代理影片總共得到16項奧斯卡提名，讓梅莉史翠普贏得影后的英國片「鐵娘子：堅固柔情」，以及讓蜜雪兒威廉斯入圍影后的「夢露與我的浪漫週記」，也都由溫斯坦公司取得美國發行權。,自由時報
2012,2,28,馬克早洩名單失準,今年奧斯卡有一顆老鼠屎，美國影星馬克華柏格在頒獎典禮前2天聲稱他從計票單位獲知得獎名單，不過昨天才頒到第3個獎最佳服裝設計，馬克的早洩名單就失準，他說會由「雨果的冒險」獲獎，真正得主卻是「大藝術家」。馬克大膽指出影后將由「姊妹」的薇歐拉戴維斯獲得，英國賭盤賠率也在一天內翻轉。梅莉史翠普這幾天的心情猶如洗三溫暖，從大熱門變第2名，又在揭曉時刻突圍獲獎。,自由時報
2012,2,28,鐵娘子變臉 逼真老妝有一套,「鐵娘子：堅固柔情」不但將「梅姨」梅莉史翠普推上奧斯卡后座，片中鬼斧神工的化妝技術也獲得評審青睞，榮獲本屆奧斯卡最佳化妝。梅姨在電影一開場以80幾歲的老妝登場，逼真的程度令許多觀眾嚇了一跳，直呼太神奇了！加入爆牙元素 梅姨更像本尊梅姨在「鐵娘子：堅固柔情」精準飾演英國前首相柴契爾夫人，從她的中年演到老，不論樣貌、聲音、腔調、姿態、甚至連臉部神情都演得很到位，除了拜梅姨的演技之賜外，化妝師傑羅伊荷倫也功不可沒。如果把柴契爾夫人本尊跟梅姨的版本拿來比一比，除了髮型、眉型、服裝等比較好調整的部分外，化妝師還特別為梅姨加入「爆牙」的元素，此方法果然讓梅姨更貼近本尊的臉型。戴上假臉皮 皺紋更清楚除了臉型要像柴契爾夫人，梅姨逼真的老妝是傑羅伊荷倫的另一項任務。他利用「翻模」的技術，以梅姨的臉型為基礎做出假的老人臉皮，讓梅姨戴上這層假皮後，呈現出更自然的老態，臉上的皺紋也顯得更清楚。反觀台灣的特殊化妝工業，雖然有越來越多年輕的人才從英國、美國學得技術，回到台灣貢獻己力，但礙於台灣電影製作的經費限制、化妝材料的匱乏，讓這些人才無法發揮所長，非常可惜。台灣電影界的資深化妝師林美玲，作品包括「賽德克‧巴萊」、「命運化妝師」，有感而發表示：「台灣做翻模的很少，特殊化妝的材料又很貴，而且做特殊化妝的機會不多，這是我們現在所面臨的問題。」特殊化妝 要翻模材料貴如果要做好一個精緻的老妝，材料及技術費用動不動就要上萬元，對預算有限的台片劇組來說的確是個負擔，所以國內的特殊化妝師都會想盡辦法在有限的資源裡，做出效果最好的作品。,自由時報
2012,2,27,華柏格惡搞 奧斯卡得主慘早洩,馬克華柏格洩密，提早將奧斯卡得獎名單公諸於世。好萊塢男星馬克華柏格惡搞奧斯卡！他聲稱事先得知本屆奧斯卡得獎名單，肆無忌憚地公布最佳影片得主是「大藝術家」，尚杜賈丹和薇歐拉戴維斯將稱帝封后！會計師事務所洩機密 華柏格亂爆料華柏格時常語不驚人死不休，他今年1月發表「我可以阻止911劫機發生」言論，引發各界撻伐，沒想到他沒學到教訓，在奧斯卡頒獎前1天洩漏得獎名單。華柏格向英國媒體「哈芬頓郵報」透露，他有朋友在知名會計師事務所「PwC」上班，這家事務所為美國影藝學院計票及管理得獎名單長達78年，不料今年卻洩漏風聲，還傳到「大嘴巴」華柏格耳裡，害本屆奧斯卡得主早洩。普拉瑪最老男配 奧塔薇雅抱女配華柏格說：「這不是我在預測誰會得獎；我知道誰確定會得獎。」根據他的說法，「大藝術家」將拿下最佳影片和最佳男主角，「姊妹」薇歐拉將打敗「梅姨」梅莉史翠普拿下最佳女主角，「新手人生」克里斯多夫普拉瑪與「姊妹」奧塔薇雅史班森則並列最佳男女配角。華柏格洩漏的得獎名單不只是演員獎項，他還補充說：「『變形金剛3』會得最佳音效剪輯，『雨果的冒險』會摘下最佳服裝、美術和攝影。」「阿湯哥」湯姆克魯斯、安吉莉娜裘莉、小勞勃道尼、葛妮絲派特蘿等A咖這幾天都忙著為奧斯卡彩排。究竟華柏格洩露的名單正不正確？今早登場的第84屆奧斯卡頒獎典禮便見分曉。台視將在今天早上8點轉播典禮盛況，STAR MOVIES及Star World將於8點30分轉播。,自由時報
2012,2,26,奧斯卡帝1夯杜賈丹 凱薩獎吃癟,「大藝術家」的尚杜賈丹是賭盤最看好的影帝。如果賭「繼承人生」的喬治克隆尼得獎，下注者有機會小賺一點。第84屆奧斯卡頒獎典禮將於台北時間週一早上舉行，英國賭盤看好「大藝術家」得最佳影片，賠率1.05，若賭它得獎，每1元只能回收1.05元。影后最看好「姊妹」的薇歐拉戴維斯，男主角則由「大藝術家」尚杜賈丹領先，但法國自家的凱薩獎卻很不給他面子，沒讓他抱回影帝獎。杜賈丹強壓克隆尼 薇歐拉勝梅姨從賭盤來看，今年男女主角都是兩強相爭，沒有壓倒性的贏家，也比較值得一賭。杜賈丹有「法國的喬治克隆尼」之稱，賭盤賠率是1.67，賭1塊只能拿回1.67塊；以「繼承人生」入圍的喬治克隆尼則是2.10，萬一他得獎，賭1塊還可以拿回2.10塊。以「鐵娘子：堅固柔情」入圍的「梅姨」梅莉史翠普，賠率是2.20，小輸薇歐拉的1.61賠率。兩人曾合演2009年的「誘惑」，雙雙入圍奧斯卡女主角與女配角摃龜。接下來梅姨將與另一位奧斯卡影后茱莉亞蘿勃茲演母女，這將是兩人首度合作，將東尼獎得獎舞台劇「August： Osage County」改拍為電影。普拉瑪橫掃各獎 奧塔薇雅獎聲高賭盤最看好的最佳女配角是「姊妹」的奧塔薇雅史班森，最不值得一賭的則是最佳男配角，「新手人生」的克里斯多夫普拉瑪飾演一位罹患癌症而向兒子出櫃的同志，已橫掃各大獎項，賠率低到只有1.02。普拉瑪是「真善美」的男主角，從未得過奧斯卡，今年82歲的他若順利得獎，將打破「溫馨接送情」潔西卡譚頓的80歲得獎紀錄，成為奧斯卡最老的得獎者。至於以「心靈鑰匙」入圍男配角的麥斯馮西度，比普拉瑪大8個月，今年4月就要83歲。他是英瑪柏格曼的御用演員，也是「大法師」裡幫忙驅魔的老神父，在「心靈鑰匙」挑戰一個遭逢心理創傷而從此不再說話的角色，不靠言語就極度感人。,自由時報
