publish_date,title,content,press
2018-03-06,好萊塢給川普「大美國主義」難堪,第九十屆奧斯卡金像獎四大得主，左起最佳男配角山姆洛克威爾、影后法蘭西絲麥朵曼、最佳女配角艾莉森珍妮與影帝蓋瑞歐德曼。                       第90屆奧斯卡金像獎得獎名單                    第九十屆奧斯卡金像獎四大得主，左起最佳男配角山姆洛克威爾、影后法蘭西絲麥朵曼、最佳女配角艾莉森珍妮與影帝蓋瑞歐德曼。                                    第九十屆奧斯卡金像獎落幕，一如往年，得獎名單沒太多驚喜，大都在各方意料之中，但從得獎者的組成來看，影劇圈人士再一次給美國總統川普主張的「傳統大美國」難堪。川普曾在大選時疾呼「要讓美國再次偉大」，甚至透露想在美國與墨西哥之間築高牆，被視為走回封閉、守舊的傳統路線，與向來崇尚自由開放的好萊塢背道而馳。今年奧斯卡最佳影片「水底情深」和動畫「可可夜總會」，前者出自墨西哥導演之手，後者情節就以墨西哥「亡靈節」為重點，除了片子本身真的成績不俗外，如此備受推崇絕非偶然，川普激出的「賭爛票」影響力不容小覷。以「水底情深」而言，類型是奧斯卡最不青睞的奇幻片，九十屆以來曾獲最佳影片的奇幻╱科幻片僅有「魔戒三部曲：王者再臨」、「水底情深」以及勉強沾上邊的「環遊世界八十天」，若非投票會員力挺，不容易在眾家強勁對手中脫穎而出。和「水底情深」競爭最激烈的「意外」，這兩個月來聲勢凌駕其上，奪下包括金球獎、英國影藝學院獎等最大獎，不過片中對於美國平凡小鎮裡的灰暗面貌挖掘太深，反倒引發部分投票會員的反感，造成支持票流向「水底情深」，在最後關頭痛失大獎。而最佳原著劇本這一項，入圍者剛好包括亞裔（愛情昏迷中）、黑人（逃出絕命鎮）、拉丁裔（水底情深）、女性（淑女鳥）和傳統白人（意外），有如具體而微的政策宣示，「逃出絕命鎮」得獎亦透露出不少玄機。,聯合報
2018-03-06,法蘭西絲麥朵曼 點名梅姨分享榮耀,第九十屆奧斯卡金像獎最佳女主角幾乎毫無意外，由被稱作「史上最強歐巴桑」的「意外」法蘭西絲麥朵曼獲得，這是她的第二座奧斯卡影后。今年稍早，她也以「意外」獲得金球獎戲劇類最佳女主角。法蘭西絲麥朵曼領獎時情緒非常激動，她自嘲說：「我現在太興奮了，如果昏倒了，麻煩來人扶我一把！」她首先感謝「意外」的導演、編劇，接著感謝她的家人，以及她的丈夫、孩子，謝謝他們多年來對她女權至上的百般忍讓包容。最後法蘭西絲麥朵曼突然彎腰，把手中的小金人獎座放在地上，揮舞著雙手邀請現場所有入圍的女性創作者起立，一同接受現場所有觀眾熱烈鼓掌致意，分享這份榮耀。最特別的是，她專程點名一身紅衣的梅莉史翠普，「因為一旦妳起立了，所有人都會跟進」。法蘭西絲麥朵曼在「意外」中扮演女兒被姦殺的心碎母親，一心只想為冤死的女兒討回公道，但是小鎮警察卻無能為力，她氣憤之下以所有積蓄買下鎮外道路上的三塊大招牌，以自己的方式控訴不公不義，反而引發更大的風波，這位母親雖然不屈不撓，卻也在追尋她想像中的公義的過程中，漸漸明白所謂的「公義」並不是只有一個。法蘭西絲麥朵曼的演出自然不造作，種種複雜情緒轉折層次分明，沒有任何多餘的表情或動作，卻能夠精準傳達主角內心的憤怒與掙扎。法蘭西絲麥朵曼曾經在一九九七年以「冰血暴」獲得奧斯卡影后，她也曾經三度入圍奧斯卡最佳女配角，同時也在二〇一一年與二〇一五年分別斬獲東尼獎（舞台劇）與艾美獎（電視劇），等於包辦所有戲劇領域獎項。法蘭西絲麥朵曼並不是典型的大銀幕美女，過硬的臉部線條反而讓她走出一條「堅毅女性」的戲路，意外成為好萊塢眾多美艷花朵中，一棵與眾不同的仙人掌。,聯合報
2018-03-06,水底情深 抱奧斯卡4大獎,最大贏家第九十屆奧斯卡金像獎最佳影片由墨西哥導演吉勒摩戴托羅（中）作品「水底情深」獲得，他率領工作人員分享光榮一刻。                       影后法蘭西絲麥朵曼再捧小金人法蘭西絲麥朵曼相隔廿一年，再度以「意外」拿下奧斯卡影后。                    最大贏家第九十屆奧斯卡金像獎最佳影片由墨西哥導演吉勒摩戴托羅（中）作品「水底情深」獲得，他率領工作人員分享光榮一刻。                                    第九十屆奧斯卡金像獎得獎名單揭曉，墨西哥名導吉勒摩戴托羅作品「水底情深」拿下最佳影片、導演、配樂、美術設計等四座獎，堪稱最大贏家。原本來勢洶洶的「意外」，法蘭西絲麥朵曼與山姆洛克威爾分別抱走最佳女主角、男配角兩大獎，「最黑暗的時刻」蓋瑞歐德曼榮登影帝，「老娘叫譚雅」艾莉森珍妮獲選最佳女配角。性侵風暴下 性平運動發聲近半年來好萊塢籠罩在金獎製片哈維溫斯坦、影帝凱文史貝西等的性侵風暴下，本屆奧斯卡頒獎典禮也無法避開相關話題，不但請到被哈維染指的艾許莉賈德、安娜貝拉史歐拉、莎瑪海耶克宣示性別平權運動的成果，其他獲獎人也把握機會為自身的族群發聲，使得電影界的年度盛會，充滿濃厚政治味。主持人吉米金莫則調侃：「小金人是好萊塢最受尊崇的男性，因為他手放在大家看得到的地方，不講髒話，非常自制。」還拿多項提名的「水底情深」打趣道：「今年因為男性太噁心，所以女性都去跟魚約會了。」史上最老的得獎人：89歲影帝大獎的「老戲骨vs.小鮮肉」之爭，「以你的名字呼喚我」二十二歲搶眼新秀提摩西夏勒梅無緣刷新「最年輕影帝」紀錄，本月下旬將年屆耳順的英國資深老將蓋瑞歐德曼憑在「最黑暗的時刻」扮演名相邱吉爾勝出，他在影壇打滾多年，商業片、嚴肅影片都拿手，「最」片卻僅是他第二度獲奧斯卡提名、首度得獎。但若比起「以你的名字呼喚我」最佳改編劇本獎得主詹姆斯艾佛利，蓋瑞又顯得小巫見大巫，詹姆斯今年已八十九歲，成為奧斯卡史上除特別獎以外最老的得獎人。他曾經執導過「窗外有藍天」、「長日將盡」等多部經典，一直沒能拿下最佳導演，終於在快要九十歲前抱走生平首座小金人。瀰漫一股「敬老尊賢」氛圍新科影后法蘭西絲麥朵曼則是繼二十一年前「冰血暴」後第二次封后，四大演技獎得主中最年輕的最佳男配角山姆洛克威爾今年都四十九歲，今年奧斯卡瀰漫著一股「敬老尊賢」的氛圍。昔日ＮＢＡ名將柯比布萊恩以參與監製的動畫短片「親愛的籃球」獲得一座小金人，寫下前輩麥可喬丹轉進影劇圈都無法達到的光榮紀錄。,聯合報
2018-03-05,國際兒童影展 裘莉監製動畫開幕,2018台灣國際兒童影展日前公布開、閉幕片，分別為安潔莉娜裘莉監製、入圍今年奧斯卡最佳動畫長片《戰火下的小花》，以及荷蘭電影《尋找杏桃街》，將在影展期間做台灣首映。                    2018台灣國際兒童影展日前公布開、閉幕片，分別為安潔莉娜裘莉監製、入圍今年奧斯卡最佳動畫長片《戰火下的小花》，以及荷蘭電影《尋找杏桃街》，將在影展期間做台灣首映。                                    2018台灣國際兒童影展日前公布開、閉幕片，分別為安潔莉娜裘莉監製、入圍今年奧斯卡最佳動畫長片《戰火下的小花》，以及荷蘭電影《尋找杏桃街》，將在影展期間做台灣首映。「台灣國際兒童影展」開幕片為《戰火下的小花》，獲得奧斯卡和金球獎最佳動畫長片提名，劇情描寫在阿富汗塔利班政權下生活的少女，因父親被抓走不惜女扮男裝，肩負起養家重任的故事。《戰火下的小花》導演諾拉涂枚表示，安潔莉娜裘莉不只是個高高在上的監製，「從討論中，我發現她不但很清楚影片製作環節，甚至還資助數百名阿富汗的女童上學」，大讚裘莉是藉由本片為孩童發聲的不二人選。,聯合報
2018-03-05,媒體戰役,《大陰謀》、《郵報：密戰》電影海報。                       《大陰謀》、《郵報：密戰》電影海報。                    《大陰謀》、《郵報：密戰》電影海報。                                    因為集合了金獎導演史蒂芬史匹柏、影后梅莉史翠普與影帝湯姆漢克斯三位得獎常勝軍，電影《郵報：密戰》（The Post）在今年奧斯卡儘管並非提名項目最多，卻是「含金量」最高的。這麼多重量級大咖合作，當然不會是想拍一部普通題材的作品。該片說的是美國史上著名的「五角大廈文件」（Pentagon Papers）事件。主角是英文片名裡點出的《華盛頓郵報》（Washington Post）。五角大廈文件 成就《華郵》《華郵》本是小報，躍升大報主要在於兩大關鍵戰役：「五角大廈文件」事件以及後來的「水門醜聞案」（Watergate Scandal）。在震撼撼性和知名度上，前者不及後者。不過，「水門案」早在1976年時就被拍成電影《大陰謀》（All the President's Men）。而且導演亞倫帕庫拉（Alan Jay Pakula）處理這齣「政治驚悚」（Political Thriller）大戲手法非常出色，不易超越，或許是這個原因，史匹柏選擇了拍攝發生在「水門案」之前的「五角大廈文件」事件。「五角大樓文件案」發生在1971年，替美國軍方擔任分析師的艾爾斯伯格（Daniel Ellsberg）不滿政府介入越戰、操控越南政治、還要欺瞞人民，憤而把國防部有關美國如何捲入越戰、長達7000多頁的機密洩露給《紐約時報》。當時的尼克森政府向法院申請禁制令，禁止《紐時》刊登這些文件。《紐時》一度被阻止了，不過，由發行人葛蘭姆（Katharine Graham）與執行編輯布萊德利（Ben Bradlee）領導的《華郵》卻跑出來接力，繼續登！美國政府以「保護機密」為由，透過法律向這兩家媒體繼續施壓，阻止刊登。不過，美國最高法院最後根據「憲法第一修正案」（First Amendment）對新聞自由的保障，判上述兩家媒體勝訴。政府媒體交峰 拍成《郵報》《郵報：密戰》說的就是這段政府跟媒體交鋒的經過。「五角大廈文件案」是一向標榜「新聞自由」的美國媒體相當驕傲的一仗。影片在這個時候推出，時間點也很適合。當今網路╱社群時代見證了紙媒的式微，但相對的卻造成假新聞(Fake News)充斥。弔詭的是，對媒體很不友善的美國總統川普點名製造「假新聞」的媒體之中，《紐時》與《華郵》都榜上有名。《郵報：密戰》這部電影的推出，其實頗有捍衛（查證比較嚴謹的）傳統紙媒的意味。Post 可指投遞 可指張貼Post這個個字用法很廣。加上定冠詞The，就變成《郵報》。當動詞用，可以指「投遞」，所以郵差的英文是Postman。它也可以指「張貼」，例如在網路上貼文，就用Post這個字。它同時又以當「字首」（Prefix）用，表示「在....之後」。例如之前很夯的一套學說「後現代主義」，英文就是Postmodernism。,聯合報
2018-03-05,阿湯哥 表情符號電影 慘烈上榜,湯姆克魯斯拿下金酸莓獎最爛男主角獎。                       「表情符號電影」是金酸莓獎大贏家，總共拿下4座獎。                    湯姆克魯斯拿下金酸莓獎最爛男主角獎。                                    固定在每一年嘲諷眾多好萊塢大明星，表彰針對許多好萊塢爛片的「金酸莓獎」，在奧斯卡獎前一天頒獎，今年大贏家是動畫「表情符號電影」，共計拿下最爛電影、最爛導演、最爛劇本及最爛幕前拍檔；去年曾經來台的大明星湯姆克魯斯，則以「神鬼傳奇」拿下最爛男主角獎，黑人男星泰勒派瑞反串演出的「梅迪亞萬聖節2」則拿下最爛女主角，至於先前拿下9項金酸莓獎提名的「變形金剛5」，最終逃過一劫，未獲得任何獎項加持。湯姆克魯斯去年帶來娛樂大片「神鬼傳奇」，雖然票房成績不俗，口碑卻極為慘烈，該片原本預計發展成系列作，如今續集的前景堪慮。珍妮佛勞倫斯的「母親！」雖不幸入圍金酸莓獎影后，最後則敗給泰勒派瑞。梅爾吉勃遜、金貝辛格皆曾獲得奧斯卡獎肯定，去年演出的「家有兩個爸Ｘ2」、「格雷的五十道陰影：束縛」讓他們拿下金酸莓獎最爛男女配角。不過大贏家則由「表情符號電影」拿下，曾有影評痛批該片「乏善可陳」、「比垃圾還不如」，被評為「年度最爛電影」，雖然影評不愛，但最後開出亮眼票房。,聯合報
